{
  "description": "Unlocks potatoes & other stuff",
  "icon": {
    "count": 1,
    "id": "minecraft:potato"
  },
  "levels": [
    {
      "attributes": {
        "minecraft:generic.movement_speed": 2.0
      },
      "cost": 1
    },
    {
      "attributes": {
        "minecraft:generic.movement_speed": 0.5
      },
      "cost": 2
    },
    3
  ],
  "name": "Potato Skill"
}