{
  "description": "Unlocks potatoes & other stuff",
  "icon": {
    "id": "minecraft:potato"
  },
  "levels": [
    {
      "attributes": {
        "minecraft:generic.movement_speed": {
          "amount": 0.1,
          "operation": "add_multiplied_base"
        }
      },
      "cost": 1
    },
    {
      "attributes": {
        "minecraft:generic.movement_speed": {
          "amount": 0.1,
          "operation": "add_multiplied_base"
        }
      },
      "cost": 2
    },
    3
  ],
  "name": "Potato Skill"
}